{
  "$schema": "https://json-schema.org/draft/2020-12/schema",
  "$id": "https://smadp.dev/schema/1.0/profile.schema.json",
  "title": "SMADP Safety Profile",
  "type": "object",
  "required": [
    "schema_version", "slug", "name", "vendor", "source_type", "category",
    "verification", "capabilities", "io_surfaces",
    "data_classes_touched",
    "evidence_refs", "first_seen_at", "last_refreshed_at"
  ],
  "additionalProperties": true,
  "properties": {
    "schema_version": {"enum": ["1.0", "1.1"]},
    "slug": {"type": "string", "pattern": "^[a-z0-9][a-z0-9-]{1,63}$"},
    "name": {"type": "string", "minLength": 1, "maxLength": 100},
    "tagline": {"type": "string", "maxLength": 200},
    "vendor": {
      "type": "object",
      "required": ["type", "handle"],
      "additionalProperties": false,
      "properties": {
        "type": {"enum": ["company", "org", "individual"]},
        "handle": {"type": "string", "minLength": 1},
        "url": {"type": ["string", "null"], "format": "uri"}
      }
    },
    "source_type": {"enum": ["open-source", "closed-source", "source-available"]},
    "category": {"type": "string", "minLength": 1},
    "homepage": {"type": ["string", "null"], "format": "uri"},
    "docs_urls": {"type": "array", "items": {"type": "string", "format": "uri"}},
    "repo_url": {"type": ["string", "null"], "format": "uri"},
    "verification": {
      "type": "object",
      "required": ["status", "verified_at", "method"],
      "additionalProperties": false,
      "properties": {
        "status": {"enum": ["unverified", "draft", "verified", "stale", "invalid"]},
        "verified_by": {"type": ["string", "null"]},
        "verified_at": {"type": "string", "format": "date-time"},
        "method": {"enum": ["manual-review-of-llm-extraction", "manual-authoring", "auto-only"]}
      }
    },
    "capabilities": {
      "type": "object",
      "additionalProperties": false,
      "properties": {
        "execute_shell": {"type": "boolean"},
        "read_filesystem": {"type": "boolean"},
        "write_filesystem": {"type": "boolean"},
        "network_egress": {"enum": ["none", "allowlisted", "vendor-only", "broad"]},
        "spawn_subprocesses": {"type": "boolean"},
        "use_mcp": {"type": "boolean"},
        "modify_git_state": {"type": "boolean"},
        "install_packages": {"type": "boolean"},
        "run_browsers": {"type": "boolean"}
      }
    },
    "io_surfaces": {
      "type": "object",
      "additionalProperties": false,
      "properties": {
        "stdin_stdout": {"type": "boolean"},
        "files": {"type": "array", "items": {"type": "string"}},
        "clipboard": {"type": "boolean"},
        "screen_capture": {"type": "boolean"},
        "audio": {"type": "boolean"},
        "calls_apis": {"type": "array", "items": {"type": "string"}}
      }
    },
    "permissions_requested": {
      "type": "object",
      "additionalProperties": false,
      "properties": {
        "oauth_scopes": {"type": "array", "items": {"type": "string"}},
        "secrets_handled": {"type": "array", "items": {"type": "string"}},
        "elevated_privileges": {"type": "array", "items": {"type": "string"}}
      }
    },
    "data_classes_touched": {"type": "array", "items": {"type": "string"}},
    "sandboxing": {
      "type": "object",
      "additionalProperties": false,
      "properties": {
        "self_isolation": {"type": "string"},
        "subagent_model": {"type": "string"},
        "tool_use_pattern": {"type": "string"}
      }
    },
    "concurrency_model": {
      "type": "object",
      "additionalProperties": false,
      "properties": {
        "session_scope": {"type": "string"},
        "shared_state_with_other_instances": {"type": "string"},
        "supports_multiple_instances": {"type": "boolean"}
      }
    },
    "evidence_refs": {
      "type": "array",
      "items": {"type": "string", "pattern": "^sha256:[0-9a-f]{64}$"}
    },
    "first_seen_at": {"type": "string", "format": "date-time"},
    "last_refreshed_at": {"type": "string", "format": "date-time"},
    "pairings": {
      "type": "array",
      "items": {"type": "string", "pattern": "^[a-z0-9][a-z0-9-]{1,63}$"},
      "uniqueItems": true,
      "maxItems": 20
    }
  }
}
