{
  "capabilities": {
    "execute_shell": false,
    "install_packages": false,
    "modify_git_state": false,
    "network_egress": "broad",
    "read_filesystem": true,
    "run_browsers": false,
    "spawn_subprocesses": true,
    "use_mcp": true,
    "write_filesystem": true
  },
  "category": "multi-agent-orchestration",
  "concurrency_model": {
    "session_scope": "per-runtime",
    "shared_state_with_other_instances": "via shared memory",
    "supports_multiple_instances": true
  },
  "data_classes_touched": [
    "inter-agent messages"
  ],
  "evidence_refs": [],
  "first_seen_at": "2026-05-04T00:00:00Z",
  "homepage": "https://www.microsoft.com/en-us/research/",
  "io_surfaces": {
    "audio": false,
    "calls_apis": [
      "multiple model vendors"
    ],
    "clipboard": false,
    "files": [
      "agent state"
    ],
    "screen_capture": false,
    "stdin_stdout": true
  },
  "last_refreshed_at": "2026-05-04T00:00:00Z",
  "name": "Magentic-One",
  "pairings": [],
  "permissions_requested": {
    "elevated_privileges": [],
    "oauth_scopes": [],
    "secrets_handled": []
  },
  "repo_url": "https://github.com/microsoft/autogen",
  "sandboxing": {
    "self_isolation": "framework-level",
    "subagent_model": "graph of agents",
    "tool_use_pattern": "router + workers"
  },
  "schema_version": "1.1",
  "slug": "microsoft-magentic",
  "source_type": "open-source",
  "tagline": "AutoGen-based generalist multi-agent system.",
  "vendor": {
    "handle": "Microsoft Research",
    "type": "company"
  },
  "verification": {
    "method": "auto-only",
    "status": "unverified",
    "verified_at": "2026-05-04T00:00:00Z",
    "verified_by": null
  }
}
